author,contenttext,date,title
jsway (不沾),"
雷文防雷資訊頁

如果你是單親、隔代教養、病患、病患照顧者或關心同志議題，親愛的房客絕對適合你。

身為父母離異下成長的小孩，在看電影時，多處把自己帶入悠宇的視角，看待大人們所遇
到並面對的種種。
我透過「在夢裏」的歌詞，以悠宇的口吻，想像他的心境。

~*-*~*-*~*-*~*-*~*-*~*-*~*-*~*-*~*-*~*-*~*-*~*-*~

(手機排版請見諒)






~~~~~~~~~~~~~~~~~~~ 雷文 主文分隔線 ~~~~~~~~~~~~~~~~~~~~~~~~~~~~~~~~~










Letter No.1
Time: 健一被指控殺人
———————————————————————————————————————

健一把拔，我心中好多問題，你是誰？
為什麼你有這麼多秘密？
上學期，老師問我林健一是誰？
我要怎麼回答？
你照顧阿嬤、煮飯給我吃、載我上下學、陪我寫作業、教我彈鋼琴。
這樣就是我把拔嗎？
但是為什麼叔叔說你殺了爸爸？
我不知道啦，可是之前跟你在一起好快樂，什麼都不用害怕。

  「我還不會飛翔
   你告訴我 我有翅膀
   以後 飛去別的地方
   俯瞰全世界
   我會很快樂嗎」

你常常在鋼琴前面寫這首歌，是寫給爸爸的嗎？
把拔你這麼厲害，怎麼可能不會飛翔！
你不是也說要帶我出國玩嗎？

我們一起彈鋼琴的時候很快樂啊，但你快樂嗎？
最近看你好像很難過，雖然你還是笑笑的。

之前，我在玩你的手機，跳出了「小尤」問你要不要約，是什麼意思？
不過你好像有約的時候，回來都會買麥當勞給我。

希望你能一直陪我長大。




Letter No.2 (attachment: 1 CD)
Time: 健一出獄，悠宇與叔叔同住
———————————————————————————————————————

那天同學把我的傘弄壞了，我只能淋雨跑去找叔叔，全身濕透了，好冷，那種時候我會很
想你，你呢，你想家嗎？你想我嗎？我跟你還是家人嗎？

  「你還會不會飛翔
   我知道你也有翅膀
   如果 飛去陌生的地方
   淋了一些雨
   會不會想家」

在山上露營那天，其實我夢到爸爸一號跟把拔二號帶著我，一起去逛夜市，還在吃飯的時
候，你就把我叫醒，後來，你就被警察抓走，當下我好害怕，是不是又要失去把拔了？


  「你會很快樂嗎
   我飛到你在的地方
   我會很快樂嗎
   在夢裡 一起回家」

好久沒有見到把拔，你過得好嗎？你現在快樂嗎？
有點想去跟把拔住，可是叔叔不准，只能寫信給你。
昨天，我又夢到你跟爸爸，我們帶阿嬤洗腰子然後回家吃飯，你們還買生日蛋糕幫我慶生
，好快樂！

在學校，大家還是會笑我沒有爸爸，但現在我會勇敢說，我有把拔二號了！

                                                                    王悠宇
———————————————————————————————————————

--

我看的場也只有3人...只能靠口碑了
新北淡水QQ
不然只靠口碑很難
祝你滿足心中的疑問
沒關係XD主要想推薦沒看的人
但...? 想知道失望在哪裡!!
三人可以恣意妄為的哭濕口罩
謝謝～主要是有推文說：悠宇厭世臉不會演。
但從和健一彈鋼琴的畫面，發現他是笑得出來的。所以想從小孩角度寫，經歷了這些事，
怎麼笑得出來？
不愧是真善美XD 不過人多啜泣聲很大嗎
我很喜歡被問到簽名是誰，悠宇慌張地嗆同學，真的是國小生的反應！
2021/06/30 XDDD 有夠有趣
悠宇版原聲帶沒fu，但放片尾超棒啊啊
阿「請」多一個字
對，被被是多打的XD，感謝！而「麥當勞」是想表達健一約完炮，都很內疚，所以買M給
悠宇，讓自己好過一點。哈哈哈腦補太多
刑警應該是叔叔XD
",2020-10-25 13:08:27,[極好雷] 親愛的房客：悠宇給健一
Lumial020 (廢貓文專用帳號),"













沒看花木蘭 不予置評





憋了一堆解析沒看 到昨天才看了天能

不知道是諾導刻意為之 還是考量到觀影者的膀胱空間不夠用(?

我認為這部2.5hr的電影如果再加上半小時 會好看很多





我看下來 整部片有兩個大問題
第一個就是: 「太快，細節又不說明」




比如一開始的主角貼臂章，演出很直覺

就是看現場來的是哪隻烏克蘭反恐部隊 就貼哪個臂章混進去

如果是一般爽片，就會用幾句話交代，而不是把這個細節在五秒內演完@@

沒跟上的觀眾就會直接當場黑人問號



類似這樣的橋段在劇中出現很多次

比如從主角被救醒 再到風力發電機 接著實驗室這段，

想一下就知道是那個維修工人包裡面有講要去哪之類的

但從主角從風力發電機混出來到實驗室，也不超過十幾秒

順順看沒在想的話只會一頭霧水吧 而且那個手勢整部片才出現三四次

連反正我很閒的量子糾纏出現次數都比他多






以及主角第一次逆行要在貨櫃待一個禮拜，

也是用一個轉場就突然過了一周，很容易會讓沒跟上的觀眾再度問號

剛好諾蘭也透過尼爾之口嘴了一下觀眾「看不懂也沒關係，睡就好惹」

一堆觀眾大概這個時候就放棄思考了吧orz





而最後的稻草則是最終大戰，有看的人應該都有發現

除了最內側逆行機和開門鎖門那個橋段之外

所謂的「敵人」都沒有出現過任何一幕

好幾分鐘的戰事都沒講到 12號城裡的戰力是不是薩托的傭兵

完全困惑阿orz



雖然這些「細節」都有用幾秒的畫面演出

一些重要線索也只會用 極少的台詞講解 (如跳海女，女主角只講一次 大概不到兩秒)


使得150分鐘長的電影，感覺要是稍微放空 就會沒get到關鍵劇情

讓觀影者一直維持神經緊張 很不舒服QQ


話說誰能跟我講 從討論要怎麼偷運送中的鈽

到長腿女主角被薩托打到趴在地上QQ

中間發生了什麼 那時我去上廁所惹






而這就是第二個問題

「觀眾的過度期待」


我之前看很多無雷文和無雷評測，

每個都說觀影前需要的知識 比如對一些物理學名詞的認識之類的


但整部電影裡面 除了重力和順序逆行之外

跟近代物理學完全沒關係啊= =

「逆行」也跟「造夢機」一樣

只是一個增加科幻設定的劇情

要是真的嚴謹的話

為什麼車會爆炸後結冰????? 逆行的只有主角而已不是嗎



總之天能其實用邏輯順序來看，是很簡易敘述的諜報片

但中間經過了諾導的故弄玄虛 比如剪的很細碎 和加上一堆科幻設定

才會有很多問號的成分在




不過我就是要看科幻設定，這樣卻弄得科幻成分不夠重

並且我在看到中間的時候就問號了


「演算機」的功能是逆轉全世界的商

但不知道演算機能夠逆轉的 是整個地球還是整個宇宙



如果讓整個宇宙逆行，那按照「發生就是發生」的定論

那即使回到工業文明發展之前，甚至史前時代，

再次重新順行後，那未來還是不會改變

地球終將會資源枯竭 並且未來人還是要再次啟動演算機

唯一的後果只有「未來被寫成死局」 這樣一點好處都沒有啊 = =




但如果演算機逆轉的範圍 只是整個地球，

類似「逆轉子彈」那樣，只是範圍大得多

那就只是相當於地球在太陽系中繼續順行，

而地球本身會隨著逆行慢慢重生，

如果再次順行地球

等於是給了人類「第二次機會」重新省思，這樣又沒有壞處 覺悟者恆幸福




這樣搶演算機要幹嘛??

第一個「沒有好處」

第二個「沒有壞處」

真的問號??????????????????


--


--
",2020-10-25 13:01:34,Re: [超糞雷] 天能 完全跟花木蘭再不同級別上的爛片!
AACKball (阿姨洗碟錄),"
雷文防雷資訊頁



~*-*~*-*~*-*~*-*~*-*~*-*~*-*~*-*~*-*~*-*~*-*~*-*~



~~~~~~~~~~~~~~~~~~~ 雷文 主文分隔線 ~~~~~~~~~~~~~~~~~~~~~~~~~~~~~~~~~

布魯斯威利最近是很缺錢嗎？從布魯克林孤兒、惡夜救援，到這部綁票追殺令，嚴格來說
都蠻B的，布魯克林還好啦，只是稍嫌沉悶。可是在這些片中，布魯斯威利都是很二線的
角色，要嘛是開頭二十分鐘就領便當了，要嘛是當個退休老人，不然就是像這部片中演的
，一個以前大概是狠角色，但是因為退休了而變成一個很重要的「拖油瓶」的感覺。要不
是凱吉哥的光環太搶眼，我覺得布魯斯威利也有慢慢歪掉的趨勢。

電影開始就是個主角的回憶片段，然後主角受到布魯斯威利的委託，要保護他去參加一次
會面，於是在一段老兵憶當年的氣氛中主角接下了委託，接著招募隊友，在平息隊友的懷
疑之後到了現場，才現原來布魯斯威利是！不是壞人，只是在騙他們，原來是有個恐怖組
織赦免者綁架了布魯斯威利的女兒，來跟布魯斯威利要一個能夠毀天滅地的量子AI系統的
啟動密碼。接著開始大軍壓境，氣氛劍拔弩張，準備進入大決戰…等等，修但幾壘，電影
才開始20分鐘耶？為什麼已經要決戰了啊啊啊！！！我原本還以為會有個轉折甚麼的，但
，這真的就是決戰場景了。只能說因為是小成本電影吧，那你還請布魯斯威利？

而且這個毀天滅地的系統吐槽點也很多，一開始很強很威猛，路人說：「那是一個AI系統
」，布魯斯威利：「不，那是一個『量子』AI系統」，我突然很佩服布魯斯威利的專業，
這句我來講應該會笑場。感覺上就是現在甚麼東西搭上量子格調就會比較高，就跟之前的
奈米一樣。而原本設計來想幫助人類社會的系統，恐怖組織的頭頭卻覺得可以用來破壞人
類的所有科技相關系統，而這會讓人類文明倒退好幾十年，但這麼威的系統，從頭到尾展
現的只有酷炫背景搭配請輸入帳密的登入畫面，短暫連進去也只是幾行程式碼在跑而已，
完全沒有摧毀人類社會的氣勢。更別提搞半天那只是父女吵架的產物…。

而主角的小隊，電影簡介中說「一隊擁有不同技能的夥伴，被派去執行不可能的任務」。
哦哦，所以是像天龍特攻隊或是不可能的任務前兩三集那樣嗎？沒有。電影中完全沒有說
他們個人有什麼特殊技巧，或是影薄到我完全沒印象，而實際戰鬥中也完全沒有類似橋段
，從頭到尾就是背後偷襲，隔著掩體開槍，衝鋒開槍，撤退開槍，有個還早早便當，一個
還中途倒戈，反過來抓住布魯斯威利女兒想跟恐怖組織交易，結果隨隨便便就把人交出去
，然後恐怖組織直接一陣掃射…你趕著下班嗎？布魯斯威利的助手被槍打中胸口，一直在
喊我要死了我要死了，結果過陣子隊員從外面一陣槍戰回來，助手一副沒什麼事的樣子問
他們外面情況怎樣的時候，那場景荒謬到我笑出來…。

赦免者的嘈點也很多，我覺得首領最大的問題是講話也講太～慢～了～，慢到我懷疑是不
是導演為了要靠文戲台詞拖時間所以叫他講這麼慢，然後講的理想抱負跟為什麼要毀掉人
類社會，大概就跟你近幾年會看到的任何動作電影中反派講的都差不多，人類就是地球最
大的害蟲啦！

或許最讓我不滿的還是布魯斯威利吧。簡介說什麼救女兒、年度動作強檔，結果他全片出
現可能沒有十五分鐘，其中多半是在車裡、在安全隔間裡，不然就是被抓了綁在椅子上，
連這段也有個超大嘈點，反派首領抓著女兒：「告訴我密碼，不然我就對她不利」，布：
「哼，我是不會說的，你也不敢殺了她」，首領：「好！」然後打了女兒一拳，布：「等
等，我說。」…你也太沒節操了吧！！！主角群在跟人數十幾倍的恐怖組織戰鬥時，我的
內心話都是：「要是當年的約翰麥克連，你們早就不知道被幹翻幾輪了。」連最後出來開
槍幹掉赦免者，都像是出自於尊重一個前輩大牌演員的安排，歲月真的不饒人啊，突然一
陣心酸。看完之後想想自己的一個半小時，更心酸了。

--
              龍破斬 ドラグ‧スレイブ
黃昏よりも昏きもの               血の流れより紅きもの
時の流れに埋もれし               偉大な汝の名において
我ここに    闇に誓わん           我等が前に立ち塞がりし
すべての愚かなるものに           我と汝が力もて
等しく滅びを与えんことを

--
",2020-10-25 12:15:12,[負雷] 綁票追殺令
tuhsiaofu (老虎桑),"
美國俄亥俄州全國家禽比賽是所有養雞人朝聖之地，每位飼主莫不摩拳擦掌，細心打扮自己
的愛禽，希望能「得冠軍，拿金牌，光榮返鄉」！

本片除了紀錄了幾位養雞人培育雞隻的過程，也側寫他們與家人之間的關係，觀眾也可以順
便學習到養雞的小常識與雞種的英文名稱，例如：來亨雞，leghorn。

家禽在展場上爭奇鬥艷，場下飼主的心情也隨著評審計分忐忑，誰說玩物喪志？套一句已故
的李國修老師的話：「人一輩子做好一件事就功德圓滿了。」



--
",2020-10-25 11:18:42,[普雷] 養雞人 Chicken People
glenna9305 (凡雲),"


在看《親愛的房客》這部電影時，
不斷想起小童星白潤音在電台訪問時說，



確實形容得很精準。
電影中那些最動人溫暖的時刻，
都來自沒有血緣關係的兩方，
那不只是單方面的守候或保護，
而是雙向的珍惜與認同，
他們鮮少開口說出「我愛你」，
然而每個舉動都出自於愛。


雷文防雷資訊頁



~*-*~*-*~*-*~*-*~*-*~*-*~*-*~*-*~*-*~*-*~*-*~*-*~



~~~~~~~~~~~~~~~~~~~ 雷文 主文分隔線 ~~~~~~~~~~~~~~~~~~~~~~~~~~~~~~~~~





在這部電影中其實觸碰到了很多議題，
同性伴侶所遭遇的日常歧視，
慢性病老人的長照問題與心理壓力，
失去親愛之人的疼痛與悔恨......
每一個都是沈重難解的社會問題，
然而導演用舉重若輕的方式，
將整部片的焦點回歸於人與人之間最純粹的「愛」，
雖然因此不免刪減了一些角色的戲份，
然而這樣的去蕪存菁讓人更容易被那份濃郁的親情給觸動。


這是個一不小心就容易流於煽情的題材，
這樣曲折的愛情與別離要催人淚其實並不困難，
然而導演卻刻意用一個節制的方式去呈現，
但正是因為這樣的收斂，
讓整部片更顯得餘韻深遠，
後坐力強勁。

我特別喜歡日常與山景的強烈對比：
主角們的家坐落於基隆港，
在瑣碎的生活中時不時能聽見汽笛的聲響，
還有那總是顯得有些憂鬱的海，
彷彿在暗示著看似平凡的生活下暗潮正在洶湧。
而合歡山的壯麗遼闊則讓一切都變得夢幻了起來，
那其中也的確穿插著健一與立維的美好回憶；
然而如此美麗的山也可能在下一瞬間變得危機四伏，
大自然的殘酷在於即使他奪去你最珍貴的東西，
你也無法將目光抽離它的美。


三個主演的選角也是一時之選。
白潤音的「厭世」臉，
格外適合悠宇這樣一個在小小年紀就經歷太多失去的孩子，
想要依戀健一卻又害怕再次失去的不安導致彆扭，
他拿捏得很好。
陳淑芳的演技不用多說（竟然還沒有得過金馬獎我真的很驚訝），
除了將糖尿病患者的苦痛與絕望詮釋得絲絲入扣以外，
她跟莫子儀間好幾場戲張力十足，
也都是我的哭點。

而我必須說林健一這個角色根本是為了莫子儀量身打造，
這個角色的複雜度可以讓小莫的演技實力全然展現出來，
他可以僅僅依靠眼神就表現出健一的隱忍、委屈、懊悔、孤獨，
但在深不見底的憂鬱之下，
仍然有些幸福的微光支撐著他，
讓他能夠偶爾展露出溫柔的笑容，
能夠繼續去付出，繼續去愛。


最後我想誠摯地推薦這部電影給你，
它或許不是那麼高潮迭起，
或許不是那麼讓人感到痛快，
它更像是一個深深的擁抱，
告訴我們即使天地有那麼多不仁，
即使我們曾經破碎一地，
仍然有人願意將我們拾起，拼回，好好珍惜。


--



部落格：
粉絲專頁：


--
",2020-10-25 11:10:47,[好微雷] 親愛的房客：愛是一切的原因
pink02 (),"
雷文防雷資訊頁



~*-*~*-*~*-*~*-*~*-*~*-*~*-*~*-*~*-*~*-*~*-*~*-*~



~~~~~~~~~~~~~~~~~~~ 雷文 主文分隔線 ~~~~~~~~~~~~~~~~~~~~~~~~~~~~~~~~~

身為也曾是醜女被全班霸凌=>努力減肥的我 看完還蠻有感觸的

先說優點

整部片雖然是動畫 但劇情流暢度還不錯

""前面“的驚悚度也很好

一下子就把劇情推進到肉不夠用的囧境XDDD

還以為要等女主角紅了 才會發生此事

而且也不落俗套 一般不都是醜女但是心地善良嗎XDDD

總之前半部還算是有點符合期待的驚悚

但到了後半部 已經變成完全不合常理的伊藤潤二獵奇風了

雖然我沒猜到會長就是男主角本人

不過到底為何人的器官被割下還可以獨立存活啦!!!

還是一切都是男主角幻想阿???

然後有個疑問是妹妹用整溶液變性再成為男主角嗎???

總之這部片還是推啦~~~




--

facebook: 

Blog: 

Youtube頻道: 

--
",2020-10-25 10:15:01,[微好雷] 整容液 從驚悚到獵奇
