author,contenttext,date,title
a23455116 (羽村翔更不用說了),"
打給後，大家安安，這邊是經歷過同拍會及歡唱場後又更愛這部電影的路人
這次要寫的東西很多很多，請大家耐心看完吧！

在此之前，還沒看過前幾篇的人可以參考一下




雖然現在回頭再看覺得自己打得真爛，怎麼敢在少這麼多東西的時候就打出來……(抹臉)



~~~~~~~~~~~~~~~~~~~~~~~~~~~~~~~~~~~~~~





有人曾經敲碗的鏡子意象來了

、
映照真實/虛幻
鏡中世界(虛幻世界，與偷核桃暗喻愛情如夢(虛幻)連結，電影世界亦同)
阻隔意象(自由)
社會學—鏡中自我(
(唐太宗：「以人為鏡，可以明得失。」)
水鏡(與水連結、心如止水→放至水的連結)
破鏡重圓(中年再相遇、重生)
異世界入口(每一個世界意象，天堂/地獄)
回憶、碎片(剪輯的零碎、阿漢的回憶)
鏡子的兩面(光與影、死亡與新生、一體兩面這些概念相同)
有裂痕就不完整，更容易碎裂(再次連結核桃不易保存，腐壞需全部丟掉然後連結心)
監視、窺探(玻璃、透明的窗，連結電影各場景)
Birdy(電影)中，離巢的鳥要飛回籠中撞上「玻璃窗戶」死去




搭配龔言脩的Hello

在這邊給大家一個大膽的想法(敬驊貼圖)，你所看到的並不是真的Birdy(連結虛幻與現實)
；或者說你看到的是阿漢回憶(想像)中的Birdy，並不是真實的Birdy。(電影亦是虛幻世界)

而在夢中什麼都有可能發生(不懂的去看全面啟動)，完全依憑夢境主人決定，電影中在澎湖
之旅之前甚至是中年戲之前都是用這種亦真亦假、現實與虛幻之間不斷來回交錯的方式。

拿電影片段來說，當過兵的人都答過數。
「雄壯、威武、嚴肅、剛直、安靜、堅強
確實、速捷、、機警、勇敢」

但是電影中少了！



若上面的文章討論為真，Birdy應該是把歌唱完的才對，但是電影中卻只到你又何必感慨就
結束了。

回憶是會有錯漏的，而通常你只會想起你想要想起的(又或者說你只會想起你記得的，即使
跟現實有所出入)，就如同當時阿漢的狀況，沒有！
也聽不見Birdy唱的歌，
。
Birdy不斷試著想要走進阿漢的世界(教堂禱告時)，但都無解，也試著表達過對阿漢的愛但
家漢聽不進去。
(兩人世界的交錯)
(再度連結Birdy中的Al及Birdy)
(也許當時的Birdy講話並不是那麼刺耳難聽，但在那時的家漢耳/眼中就是如此)
(？
。
這些都是家漢當時沒有意識到的事。)

其實很多電影中的對話也都讓人感覺少了些什麼，不只是因為瞿導想要留白給觀眾想像空間
、填補自己的故事，也是因為阿漢的記憶就是如同碎片一樣，是拼湊而成的；
。(虛幻、電影
世界)

我們都習慣了用全知觀點看電影，但就如同瞿導說的，電視劇比較像在餵食，電影及電視劇
的表現方式是不一樣的。
關在籠裡的鳥忘了怎麼飛，甚至把會飛的同類當異類。
被豢養的獸忘了怎麼狩獵，遺忘了在草原奔馳的自由。
這部電影不只讓我回想起初戀，更是讓我想起已經遺忘的本能與初心，也是我特別感動的原
因。


再回到鏡中自我的概念

呈現：

想像的判斷：
Birdy因為阿漢的話開始想像與判斷自己是否是在談戀愛(下集那邊的想法)
主觀的解釋：
Birdy最後選擇了逃避

我們從電影屏幕看到家漢是一層阻隔、從電影中阿漢的角度看電影中的人又是一層阻隔，我
們自己也是一面鏡子，裡面的每個人物都是映射到阿漢心中再映射到我們身上，三面鏡子相
互映射，也因此我們有了自己的詮釋(亦是三層)

每句臺詞看似只是角色們的對話卻也都可以交互映射，最後映射回觀影的我們心中。
這也可以跟後面的循環有所連結。

而三面鏡子互相映射、填補，但是最後主觀的解釋權在我們手裡，也就有了不一樣的詮釋角
度，因為每面鏡子長得不一樣、映射角度也都不同，映射出的影像自然也不同，這也是為什
麼沒有標準答案的原因。
三面鏡子交互映射最後的結果就是我中有你，你中有我，你可能是Birdy也可以是家漢。









以及每段告解時的對話

當家漢映射出其他角色的時候，也同時映射出正在觀影的你。
而你，敢面對真實的自己嗎？

只能說，這部電影真的很吃感受度。







家漢的那抹笑容


想像一個畫面，神父陪在家漢身邊，一片一片撿起了回憶的碎片，手上被割的傷痕累累﹑血
流如注卻仍執意撿起，一邊看著回憶的片段，一邊像在數花瓣一樣。



在內心對話與神父的辯證中掙扎，想要認清自己，那段內心的掙扎亦是最吸引我的地方，所
以我真的超愛告解部分。
也許很多人不是很了解原罪的概念，對於不相信的人輕如鴻毛，但是這些在一個擁有虔誠信
仰的人心中是重如泰山，甚至是否定自身存在，而阿漢也是因為愛的關係，跨過了心中這道
檻。(我想這亦是導演內心的掙扎，訪談還是新聞中導演有提到過，同性戀的原罪)

()
禁錮自己的不是上帝，是自己。(連結第一篇監視意象)

神父，亦是Birdy的對照組。(同樣的深櫃)
()


接下來連結電影裡面的鏡子意象(照電影時序推進，有遺漏歡迎幫忙補充)

















.()


1.2.3.6.7.11.14皆是無所不在的監視、威權象徵

2.
有兩次，一次是搜查房間
一次是瘦瘦在浴室被打前，望進去一片漆黑的寢室(同6)
威權壓迫、逃不開的監視下沒有光(希望)

3.
看進去時是一片紅色(地獄意象)。
每個旁人角度看到Birdy與家漢都可以連結〈這個世界〉。

4.
能代表的是阿漢誠實面對自己的內心，以及神父無法面對真實的自己。

5.
鏡子映照出的真實，媽媽若有所悉的表情。

8.
鴿子在玻璃窗，虛幻的自由、看似自由卻被禁錮於窗上。(同13)

9.
阿漢的內心同水光充滿漣漪不平靜。

10.
亦虛亦實，來自其他世界(天堂/地獄？過去/未來？)的意象，亦為映射出阿漢的內心，也對
照Birdy推開家漢。
阿漢將老人推開後，老人落寞的側臉淡化轉場與告解時阿漢的側臉重疊，這邊對照意味很明
顯了。

12 .
最重點的來了。
在維護整潔的標語(威權的壓迫)及水氣(情感)的影響下，無法映出真實。

而浴室中的兩人亦如同兩面鏡子。
一開始Birdy不敢面對真實的自己及勃發的慾望，直到阿漢強迫他轉身。
兩人的慾望相互映照的結果便一發不可收拾。

想像兩面鏡子越靠越近，最後融為一體，只能在鏡中看到對方，卻無法聽到聲音，也無法觸
碰到對方(搭配電影中兩人的每次大吼及電影宣傳曲Hello)。

這邊的交錯意象

光與影只有在正午時分，太陽直射時才可能融為一體，其他時間有光必有影，只有光/影的
世界除了那短暫片刻的交錯其他時間是不可能存在的。
亦可參考你的名字的黃昏之時。


兩面鏡子交融在一起的結果是只能凝望，無法再在一起。
家漢以為打破了鏡子(阻隔意象)就能見到Birdy，卻不知道Birdy不在那裡(迷失在虛幻世界)
。
Birdy想保護鏡子不被打破，只要能夠凝望就能滿足，卻也是不敢面對自己及家漢的感情。
但那面鏡子終究被打破了，從一開始的裂痕逐漸擴大，最後應聲碎裂。



















張惠妹〈人質〉


13.同8，虛幻的自由。

15.16亦皆為映照出真實，15亦有光影、希望要素(經過隧道)

17.對照組，亦可連結「」
年輕時是阿漢看著Birdy，中年是Birdy看著阿漢。
兩人互為表裡、世界又有了交集。






~~~~~~~~~~~~~~~~~~~~~~~~~~~~~~~~~~~~~~~~~~~~~




後記：
努力先生出一篇，還有好多要打，不知道能不能打完，然後一邊打一邊覺得自己語言及文字
之貧瘠，內心的感覺實在難以言喻，如果你們喜歡我再多打一點文章。

經過同拍會和歡唱場的洗禮後真的更愛這部電影，感覺電影好像成真了，家漢跟Birdy真的
出現了，而且很幸福，有好多人也為他們高興。

而參加活動亦是在虛與實交替，而我也深深掉進電影世界無法自拔，最後決定活在當下，能
追就追了，就好像跟電影談了一場戀愛，是一場心靈饗宴。

原本想要一次打完，但是還要追簽書會跟歡唱場，最後還是決定再多分個幾篇了。

如果你無法理解我們為什麼這麼喜歡這部電影，我會送你〈這個世界〉，也可以多支持其他
電影也沒關係。
如果你想加入我們，我亦會告訴你，歡迎來到我們〈擁擠的樂園〉。


最後，還是希望刻在能破億，那是我9/25看完電影後許下的生日願望。
看在我打了好多好多的分上，帶著你的親朋好友去享受一場關於愛的電影，好嗎？

--


可以多帶還沒看過電影的捧油進場支持唷
原本的我也很少這麼注意及聯想這麼多細節，都是被刻在打破了
有哪裡沒注意到或是我文章有缺漏部分不妨跟我討論分享唷！
一邊打這些的時候一邊響起擁擠的樂園
「有人找到他自己的答案，當他不需要愛情」
當盡量抽離家漢及Birdy才會看到這些
看到不少同好跟我一起被折磨(？)我就心安了(？)
接下來是蠻重要氣球部分及數字相關的部分
最後應該會再來個所有場景對照組
然後據朋友轉述，瞿導在星期一映後有說還有彩蛋未被發現的樣子
謝謝！
很多部分還是要靠個人自行感受
也希望看完我的文章的人也能感受到我想分享的愛
距離一億還剩1700萬左右！
真的，越挖越深，我快出不來了

(抱
中年戲絕對是個救贖
有任何心得都可以分享
妳並不是孤單一個人
所有愛著這部電影的人都是你的好朋友

我已經這樣一個多月了(笑
謝謝，有遺漏或有新發現都歡迎討論！
一邊寫一邊抱怨時間不夠用
根本自虐
對兩人來說是炙熱的愛
在外人來看卻可以是地獄()
角度不同，映射出的畫面亦不同
當然，這也是我個人感受不用全部接受
主要還是你個人觀影感受重要
也是我上面提到的，避免只是被餵食的狀況
",2020-10-30 00:42:58,[好雷]刻在你心底的名字個人解讀及意象補充-1
kaze1225 (kaze),"
（已於推文更新10/30第二波物販的一點周邊）

這篇是日本上映時的心得
之前有在西洽發過
後來想說因為是有雷心得
等台灣的上映日再轉來movie版
內容也有加強一些（主要是周邊的部分
話說最近日本的電影院又迎來了超可笑的新規定
就是沒什麼人的平日規定梅花座
但人潮眾多的禮拜五六日座位全賣但不能吃東西
嗯...

抱怨完了XDD進入正文
文章順序為日本剛上映時的狀況，周邊分享，便利商店合作，有雷心得，無雷雜談
心得前後會有防雷警示


網誌好讀版





上映這天我附近的這家電影院早上六點開門
（平常都八點半左右
放映場次滿到漫出來

（剛剛去看了台灣的時刻表也是蠻誇張的w

選擇早上第一場的IMAX版
身為每個禮拜都會一個人去看電影的寂寞男子
因禍得福享受了名為梅花座的幸福
不必再去在意旁座的人是男是女是胖是瘦是不是厄介
但以鬼滅的票房為契機
久違地全座席販售
剝奪了我看電影的小確幸
也剝奪了我們的爆米花！
（因應全開放所以不能吃東西只能喝飲料


太令人難過了

發完牢騷來分享一下
相當盛大，就連裡面都是鬼滅的非劇場限定周邊




平常一部作品大概就一個區塊而已


拍一下有買的商品
豪華版場刊
硬殼＋CD＋一般版場刊








墊板們


看完作品後馬上怒買一塊超大尺寸壓克力模型力模型


順帶一提看完出來大哥的一般尺寸壓克力就已經完售了
其他人都還有很多








前面有煉獄大哥的過去的小故事
後面則是訪談

著色畫















其中最令人印象深刻的就屬彌豆子的台詞
mu~!


順帶一提相信大家也知道鬼滅已經是現象級的爆紅
各種當然不會少
這裡簡單附上一些便利商店Lawson的圖吧～








無處不合作，相信還有很多漏掉的部分
雖然Lawson本來就常被戲稱為ACG專賣店（合作超多）
但搞到這種規模的也真的算少見w

自己也買了からあげクン和黑炒飯


炒飯會送一張合作卡片
選了煉獄大哥的


炒飯本身就...蠻好吃的w


雞塊

背面（抽到了善逸）



以上為有的沒的分享～










接下來進入











先說一下
我是動畫派
但後面的劇情都被捏得差不多了
大概知道整體發展跟一些重要事件
有點像是在看記憶拼圖時雖然知道結果可是不了解過程w


先用一句話概括整體心得


在故事的最後
旁邊也傳出了陣陣鼻涕聲
不會輸紫羅蘭永恆花園時的盛況
對於在影院裡不輕易表露情感的日本人來說
沒禮貌的聲音也成了對作品獻上最大的掌聲
當然
我也是其中的一員
對於一個實質上我們並不認識的角色
可以在短短不到兩小時
就把他的特色與人格魅力渲染到頂點
讓觀眾跟著他心臟狂跳
只能說幽浮桌的說故事功力進步幅度有目共睹
老實說我一直比較喜歡有各種缺陷的主角
這一部的角色說實在的性格都比較偏向單一
聖母型，完全正義型也不少
可是意外地就是合我的胃口
特別是這次
煉獄大哥！讓我叫你一聲大哥！

劇情部分
前四分之三左右是對抗下弦壹
先是來一手無限月讀
看到各自美好的夢境
炭治郎一進入夢境時的那一句「好像是做了一場惡夢」
以及最後背對家人離開
真的是蠻揪心的
特別是在這裡放了炭治郎之歌的純音樂BGM
在他講到自己已經失去的時候
不禁想起歌詞裡的
「失っても 失っても 生きていくしかない
どんなにうちのめされても 守るものがある」
（即使失去，即使失去，也只能繼續活下去
不論如何被打垮，也有需要守護的事物）
能夠再次利用這首神曲默默地渲染情緒，真的佩服這說故事的功力

其後的戰鬥不禁讓人想起Re0的486
用自殺流破解招式
每次他自殺都不禁想到
誒誒誒你沒看過全面啟動嗎
你不怕等等就在現實自殺了嗎
結果也是如此幸好豬豬及時相救
也不得不說這場的豬有帥到
而說到有帥到
睡夢中英雄救美的善逸
我是彌豆子的話看到那一下大概也愛上了（茶
喔對了小彌豆子的日常賣萌這次份量也很足ww

雖然前面整體表現就已經不錯了
到了真正的決戰煉獄vs上弦參
會發現
一切都是為了秤托側寫出這場戰鬥的魄力
前期對於煉獄的描寫都是他很強
一個人負責五節車廂無人死亡
卻沒有實際體現（除了一開始跟那兩隻鬼如夢似幻的對戰
但到了這裡
連豬豬都忍不住說出完全無法插手
然後幽浮桌也沒有讓我們失望
上弦參對戰時的背景音樂超搭
上弦參開血鬼術時的陣也是特效開滿
炎之呼吸呈現的要多好就有多好
彷彿在看劇場版般的製作啊！
啊對也現在就是劇場版
但其實這幾年戰鬥特效就算是劇場版能做到這樣的也不多了
炎之呼吸在列車裡第一次使用時
一盞盞火相繼點燃的特效就夠帥了
後面跟上弦對招時更是生猛
打擊感實在是太棒了
另一方面
上弦參的角色也很有趣
在被陽光逼急之前
不斷杏壽郎杏壽郎的叫
真心希望他可以回來變成鬼一直跟自己切磋
還不斷提醒他在這樣下去會死
雖然也不是什麼嶄新的設定
但看到他對一個之前不斷被描寫有多強的角色
游刃有餘地這樣說還是很有趣

可惜在最後煉獄終於還是受了致命傷
炭治郎追下去補一刀也不見效
接下來的大段哭喊
我也跟著哭了
旁邊的觀眾們也哭了
花江的演技是真的好
而且還在這一段搭配上炭治郎之歌的重新編曲版
情緒整個都被帶起來
直到最後的「煉獄大哥沒有輸
車上一個人都沒有死
是煉獄大哥的勝利」
想想其實我們觀眾也跟炭治郎一樣
正式認識炎柱也不過一兩小時
心中卻嘶吼著一樣的話語

聽著炭治郎吶喊的
煉獄也出現溫柔的微笑
很有趣的表現手法是
這裡應該是整部作品最令人難過的地方
卻是太陽升起
畫面最光亮溫暖的時刻
雖然大哥要走了
但他就像升起的陽光一樣
會陪著夥伴以及後輩們繼續奮鬥

這邊兩人對視
又美又溫柔，卻又充滿力量
雖然感覺很難
但如果出膠捲的話價格不敢想像
而後母親身影浮現
來迎接努力守護諾言的兒子一起離開
也不禁令人感到欣慰

最後隨著大家接到消息，產屋敷的話故事降下帷幕

緊接而來的片尾曲
做得很像傳說中的第19話
用的圖都是煉獄相關的
聽著歌詞

「君の言葉　君の願い
僕は守りぬくと誓ったんだ」

「手を伸ばし抱き止めた激しい光の束
輝いて消えてった　未来のために
託された幸せと　約束を超えて行く
振り返らずに進むから
前だけ向いて叫ぶから
心に炎を灯して
遠い未来まで……」
（有點長建議直接搜尋中文歌詞（被打

再次深深感受到這就是煉獄大哥的主題曲
再次深深地感受到自始至終，這部電影的用心











結尾防雷









心得就到此告一段落了
老實說雖然很期待
但沒有想到成品會是如此震撼
文戲打戲都屬上上之作
滿滿的細節與誠意
或許漫畫黨會有其他意見我不清楚
但以一個幾乎算是動畫黨的人來說
看完時手裡拿著衛生紙
心中仍五味雜陳久久不能言語
是部非常優秀的作品

話說去看了日本各大電影網站的評論
不意外地
幾乎都是粉絲的五星跟鬼滅黑的一星www

順帶一提
網誌裡有另一篇舞台挨拶（聲優，製作方親自到劇院的見面座談會）的轉播簡易紀錄

會有劇透，有興趣的話建議在觀影之後再去看
（沒意外的話10/31那場也會做紀錄）
此外
刷了蠻多場
手上有多的入場者特典想說可以拿來送
在舞台挨拶那一篇會詳細說




最後
感謝觀看～




--
對啊新一波東西超多的
話說官網都能訂只是我不太清楚能不能轉送到台灣
買爆!
這篇的只是冰山一角~真的要統計起來根本沒完沒了XD
大哥沒有輸！
每個禮拜都會看電影現在各種場刊已經快擺不下了XD
能讓人回味起電影的感動覺得打這篇更有意義了QQ
我附近的店在活動剛開始的時候各種類都蠻齊的XD
基本上差不多
竊竊私語或是坐姿奔放的就算惹
還遇過手機螢幕一直閃
拿起來看無數次卻不把手機螢幕調暗的（雖然後者就算是梅花座也會被影響w
美味い！
官網可以訂購喔～
真的QQ
這才想起來上映之後一直沒去jump shop晃晃
之後找個平日去看一下好了感覺假日就很可怕w

(追加)

剛剛一大早去排隊搶物販
來曬曬戰利品XD
話說這次也是目測七成以上都是女性在排隊

車票夾


順帶一提夢限跟無限是諧音

大哥的日輪刀吊飾


壓克力模型


拿來跟之前買的超大模型比大小w


發光小人

太可愛就手滑惹

用上参招式設計的手鏡

有點捨不得打開w
然後這一段電影的特效真的神到炸

本次重點的大哥發聲吊飾！


是偏硬的橡膠質感

錄了一下實際的聲音
（未看先猜第一句是美味い！


要整個壓住才有聲音不能放開
有點麻煩（汗

然後官網說有12種聲音
只是不知道為什麼怎麼試都是以下六種

美味い！
俺の嗣子になるといい　面倒を見てやろう
この煉獄の赫き炎刀が　お前の骨まで焼き尽くす
炎の呼吸壱の型　不知火
炎の呼吸弍の型　昇り炎天
よもやよもやだ、柱として不甲斐なし
（不太清楚台灣漫畫的正式翻譯就不亂翻了）

如果有人知道如何解鎖（？）剩下六種聲音的話懇請告知
BTW我結帳完之後這個就完售惹

此外還有原畫明信片

我大風柱放第一張
真是太有sense惹

內容就比較明顯的劇透了
想看圖的可以到官網有範例




這些之後都可以從幽浮桌（或A+）官網訂
雖然我不太確定轉運到台灣怎麼用
但有興趣的版友可以試試
",2020-10-30 00:28:47,[好雷] 鬼滅之刃無限列車篇 周邊分享&觀影心得
